{
  "exercise": "minesweeper",
  "version": "1.2.0",
  "comments": [
    " The expected outputs are represented as arrays of strings to   ",
    " improve readability in this JSON file.                         ",
    " Your track may choose whether to present the input as a single ",
    " string (concatenating all the lines) or as the list.           "
  ],
  "cases": [
    {
      "description": "no rows",
      "property": "annotate",
      "input": {
        "minefield": []
      },
      "expected": []
    },
    {
      "description": "no columns",
      "property": "annotate",
      "input": {
        "minefield": [
          "++",
          "++"
        ]
      },
      "expected": [
        "++",
        "++"
      ]
    },
    {
      "description": "no mines",
      "property": "annotate",
      "input": {
        "minefield": [
          "+---+",
          "|   |",
          "|   |",
          "|   |",
          "+---+"
        ]
      },
      "expected": [
        "+---+",
        "|   |",
        "|   |",
        "|   |",
        "+---+"
      ]
    },
    {
      "description": "minefield with only mines",
      "property": "annotate",
      "input": {
        "minefield": [
          "+---+",
          "|***|",
          "|***|",
          "|***|",
          "+---+"
        ]
      },
      "expected": [
        "+---+",
        "|***|",
        "|***|",
        "|***|",
        "+---+"
      ]
    },
    {
      "description": "mine surrounded by spaces",
      "property": "annotate",
      "input": {
        "minefield": [
          "+---+",
          "|   |",
          "| * |",
          "|   |",
          "+---+"
        ]
      },
      "expected": [
        "+---+",
        "|111|",
        "|1*1|",
        "|1*1|",
        "+---+"
      ]
    },
    {
      "description": "space surrounded by mines",
      "property": "annotate",
      "input": {
        "minefield": [
          "+---+",
          "|***|",
          "|***|",
          "|***|",
          "+---+"
        ]
      },
      "expected": [
        "+---+",
        "|***|",
        "|*8*|",
        "|***|",
        "+---+"
      ]
    },
    {
      "description": "horizontal line",
      "property": "annotate",
      "input": {
        "minefield": [
          "+-----+",
          "| * * |",
          "+-----+"
        ]
      },
      "expected": [
        "+-----+",
        "|1*2*1|",
        "+-----+"
      ]
    },
    {
      "description": "horizontal line, mines at edges",
      "property": "annotate",
      "input": {
        "minefield": ["*   *"]
      },
      "expected": ["*1 1*"]
    },
    {
      "description": "vertical line",
      "property": "annotate",
      "input": {
        "minefield": [
          "+-+",
          "| |",
          "|*|",
          "| |",
          "|*|",
          "| |",
          "+-+"
        ]
      },
      "expected": [
        "+-+",
        "|1|",
        "|*|",
        "|2|",
        "|*|",
        "|1|",
        "+-+"
      ]
    },
    {
      "description": "vertical line, mines at edges",
      "property": "annotate",
      "input": {
        "minefield": [
          "+-+",
          "|*|",
          "| |",
          "| |",
          "| |",
          "|*|",
          "+-+"
        ]
      },
      "expected": [
        "+-+",
        "|*|",
        "|1|",
        "| |",
        "|1|",
        "|*|",
        "+-+"
      ]
    },
    {
      "description": "cross",
      "property": "annotate",
      "input": {
        "minefield": [
          "+-----+",
          "|  *  |",
          "|  *  |",
          "|*****|",
          "|  *  |",
          "|  *  |",
          "+-----+"
        ]
      },
      "expected": [
        "+-----+",
        "| 2*2 |",
        "|25*52|",
        "|*****|",
        "|25*52|",
        "| 2*2 |",
        "+-----+"
      ]
    },
    {
      "description": "large minefield",
      "property": "annotate",
      "input": {
        "minefield": [
          "+------+",
          "| *  * |",
          "|  *   |",
          "|    * |",
          "|   * *|",
          "| *  * |",
          "|      |",
          "+------+"
        ]
      },
      "expected": [
        "+------+",
        "|1*22*1|",
        "|12*322|",
        "| 123*2|",
        "|112*4*|",
        "|1*22*2|",
        "|111111|",
        "+------+"
      ]
    }
  ]
}
