{
  "exercise": "pangram",
  "comments": [
    "A pangram is a sentence using every letter of the alphabet at least once."
  ],
  "version": "1.2.0",
  "cases": [
    {
      "description": "checks if the given string is a pangram.",
      "comments": [
        "Output should be a boolean denoting if the string is a pangram or not."
      ],
      "cases": [
        {
          "description": "returns false for an empty message.",
          "property": "isPangram",
          "input": "",
          "expected": false
        },
        {
          "description": "returns false for an undefined/null message as argument.",
          "property": "isPangram",
          "input": null,
          "expected": false
        },
        {
          "description": "recognizes a perfect lower case pangram.",
          "property": "isPangram",
          "input": "abcdefghijklmnopqrstuvwxyz",
          "expected": true
        },
        {
          "description": "recognizes missing characters, e.g. 'x'.",
          "property": "isPangram",
          "input": "aquickmovementoftheenemywilljeopardizefivegunboats",
          "expected": false
        },
        {
          "description": "recognizes missing characters, e.g. 'h'.",
          "property": "isPangram",
          "input": "fiveboxingwizardsjumpquicklyatit",
          "expected": false
        },
        {
          "description": "recognizes an upper-case pangram.",
          "property": "isPangram",
          "input": "THEQUICKBROWNFOXJUMPSOVERTHELAZYDOG",
          "expected": true
        },
        {
          "description": "recognizes a missing character in upper-case, e.g. 'G'.",
          "property": "isPangram",
          "input": "THEQUICKBROWNFOXJUMPSOVERTHELAZYDOLL",
          "expected": false
        },
        {
          "description": "recognizes a mixed-case pangram.",
          "property": "isPangram",
          "input": "ThEFiVebOxInGWiZaRdSJuMpqUiCkLy",
          "expected": true
        },
        {
          "description": "recognizes a missing character in mixed-case, e.g. 'Y'.",
          "property": "isPangram",
          "input": "ThEFiVebOxInGWiZaRdSJuMpqUiCkL",
          "expected": false
        },
        {
          "description": "recognizes a pangram even if additional characters other than a-z are present.",
          "property": "isPangram",
          "input": "Victor_jagt-zwölf.B0xkämpfer >qu3r<über;den'großen\" Sylter#Deich!",
          "expected": true
        },
        {
          "description": "recognizes missing characters (e.g. 'd') even if additional characters other than a-z are present.",
          "property": "isPangram",
          "input": "Victor_jagt-zwölf.B0xkämpfer >qu3r< über;einen'großen\" Sylter#Teich!",
          "expected": false
        }
      ]
    }
  ]
}
