{
  "exercise": "all-your-base",
  "version": "2.0.0",
  "comments": [
    "It's up to each track do decide:",
    "",
    "1. What's the canonical representation of zero?",
    " - []? (if your track does this iff the input was empty, then follow if_your_track_translates_empty_to_empty)",
    " - [0]? (if your track does this, then follow if_your_track_outputs_zero_as_a_single_zero)",
    "",
    "2. What representations of zero are allowed?",
    " - []? (if your track allows this, then follow if_your_track_allows_empty_input_digits)",
    " - [0]? (if your track allows this, then follow if_your_track_allows_single_zero_as_input)",
    " - [0,0]? (if your track allows this, then follow if_your_track_allows_leading_zeroes_in_input)",
    "",
    "3. Are leading zeroes allowed?",
    "If so then follow if_your_track_allows_leading_zeroes_in_input",
    "",
    "4. How should invalid input be handled?",
    "",
    "All the undefined cases have objects under the `expected` key",
    "showing the different possible choices one can take.",
    "",
    "todo: one could imagine an explanation of the choices object",
    "",
    "All your numeric-base are belong to [2..]. :)"
  ],
  "cases": [
    {
      "description": "single bit one to decimal",
      "property": "rebase",
      "input_base": 2,
      "input_digits": [1],
      "output_base": 10,
      "expected": [1]
    },
    {
      "description": "binary to single decimal",
      "property": "rebase",
      "input_base": 2,
      "input_digits": [1, 0, 1],
      "output_base": 10,
      "expected": [5]
    },
    {
      "description": "single decimal to binary",
      "property": "rebase",
      "input_base": 10,
      "input_digits": [5],
      "output_base": 2,
      "expected": [1, 0, 1]
    },
    {
      "description": "binary to multiple decimal",
      "property": "rebase",
      "input_base": 2,
      "input_digits": [1, 0, 1, 0, 1, 0],
      "output_base": 10,
      "expected": [4, 2]
    },
    {
      "description": "decimal to binary",
      "property": "rebase",
      "input_base": 10,
      "input_digits": [4, 2],
      "output_base": 2,
      "expected": [1, 0, 1, 0, 1, 0]
    },
    {
      "description": "trinary to hexadecimal",
      "property": "rebase",
      "input_base": 3,
      "input_digits": [1, 1, 2, 0],
      "output_base": 16,
      "expected": [2, 10]
    },
    {
      "description": "hexadecimal to trinary",
      "property": "rebase",
      "input_base": 16,
      "input_digits": [2, 10],
      "output_base": 3,
      "expected": [1, 1, 2, 0]
    },
    {
      "description": "15-bit integer",
      "property": "rebase",
      "input_base": 97,
      "input_digits": [3, 46, 60],
      "output_base": 73,
      "expected": [6, 10, 45]
    },
    {
      "description": "empty list",
      "property": "rebase",
      "input_base": 2,
      "input_digits": [],
      "output_base": 10,
      "expected": {
        "choices": {
          "if_your_track_allows_empty_input_digits": {
            "choices": {
              "if_your_track_translates_empty_to_empty": [],
              "if_your_track_outputs_zero_as_a_single_zero": [0],
              "otherwise": []
            }
          },
          "otherwise": {"error": "input digits cannot be empty"}
        }
      }
    },
    {
      "description": "single zero",
      "property": "rebase",
      "input_base": 10,
      "input_digits": [0],
      "output_base": 2,
      "expected": {
        "choices": {
          "if_your_track_allows_single_zero_as_input": {
            "choices": {
              "if_your_track_outputs_zero_as_a_single_zero": [0],
              "otherwise": []
            }
          },
          "otherwise": {"error": "leading zeroes not allowed"}
        }
      }
    },
    {
      "description": "multiple zeros",
      "property": "rebase",
      "input_base": 10,
      "input_digits": [0, 0, 0],
      "output_base": 2,
      "expected": {
        "choices": {
          "if_your_track_allows_leading_zeroes_in_input": {
            "choices": {
              "if_your_track_outputs_zero_as_a_single_zero": [0],
              "otherwise": []
            }
          },
          "otherwise": {"error": "leading zeroes not allowed"}
        }
      }
    },
    {
      "description": "leading zeros",
      "property": "rebase",
      "input_base": 7,
      "input_digits": [0, 6, 0],
      "output_base": 10,
      "expected": {
        "choices": {
          "if_your_track_allows_leading_zeroes_in_input": [4, 2],
          "otherwise": {"error": "leading zeroes not allowed"}
        }
      }
    },
    {
      "description": "first base is one",
      "property": "rebase",
      "input_base": 1,
      "input_digits": [],
      "output_base": 10,
      "expected": null
    },
    {
      "description": "first base is zero",
      "property": "rebase",
      "input_base": 0,
      "input_digits": [],
      "output_base": 10,
      "expected": null
    },
    {
      "description": "first base is negative",
      "property": "rebase",
      "input_base": -2,
      "input_digits": [1],
      "output_base": 10,
      "expected": null
    },
    {
      "description": "negative digit",
      "property": "rebase",
      "input_base": 2,
      "input_digits": [1, -1, 1, 0, 1, 0],
      "output_base": 10,
      "expected": null
    },
    {
      "description": "invalid positive digit",
      "property": "rebase",
      "input_base": 2,
      "input_digits": [1, 2, 1, 0, 1, 0],
      "output_base": 10,
      "expected": null
    },
    {
      "description": "second base is one",
      "property": "rebase",
      "input_base": 2,
      "input_digits": [1, 0, 1, 0, 1, 0],
      "output_base": 1,
      "expected": null
    },
    {
      "description": "second base is zero",
      "property": "rebase",
      "input_base": 10,
      "input_digits": [7],
      "output_base": 0,
      "expected": null
    },
    {
      "description": "second base is negative",
      "property": "rebase",
      "input_base": 2,
      "input_digits": [1],
      "output_base": -7,
      "expected": null
    },
    {
      "description": "both bases are negative",
      "property": "rebase",
      "input_base": -2,
      "input_digits": [1],
      "output_base": -7,
      "expected": null
    }
  ]
}
