{
  "exercise": "allergies",
  "version": "1.2.1",
  "comments": [
    "Given a number and a substance, indicate whether Tom is allergic ",
    "to that substance.",
    "Test cases for this method involve more than one assertion.",
    "Each case in 'expected' specifies what the method should return for",
    "the given substance."
  ],
  "cases": [
    {
      "description": "no allergies means not allergic with:",
      "cases": [
        {
          "description": "peanuts",
          "property": "allergicTo",
          "input": {
            "item": "peanuts",
            "score": 0
          },
          "expected": false
        },
        {
          "description": "cats",
          "property": "allergicTo",
          "input": {
            "item": "cats",
            "score": 0
          },
          "expected": false
        },
        {
          "description": "strawberries",
          "property": "allergicTo",
          "input": {
            "item": "strawberries",
            "score": 0
          },
          "expected": false
        }
      ]
    },
    {
      "description": "allergic to only eggs",
      "property": "allergicTo",
      "input": {
        "item": "eggs",
        "score": 1
      },
      "expected": true
    },
    {
      "description": "allergic to eggs in addition to other stuff like:",
      "property": "allergicTo",
      "cases": [
        {
          "description": "eggs",
          "property": "allergicTo",
          "input": {
            "item": "eggs",
            "score": 5
          },
          "expected": true
        },
        {
          "description": "shellfish",
          "property": "allergicTo",
          "input": {
            "item": "shellfish",
            "score": 5
          },
          "expected": true
        },
        {
          "description": "strawberries",
          "property": "allergicTo",
          "input": {
            "item": "strawberries",
            "score": 5
          },
          "expected": false
        }
      ]
    },
    {
      "description": "allergic to strawberries but not peanuts with:",
      "property": "allergicTo",
      "input": {
        "score": 9
      },
      "cases": [
        {
          "description": "eggs",
          "property": "allergicTo",
          "input": {
            "item": "eggs",
            "score": 9
          },
          "expected": true
        },
        {
          "description": "peanuts",
          "property": "allergicTo",
          "input": {
            "item": "peanuts",
            "score": 9
          },
          "expected": false
        },
        {
          "description": "shellfish",
          "property": "allergicTo",
          "input": {
            "item": "shellfish",
            "score": 9
          },
          "expected": false
        },
        {
          "description": "strawberries",
          "property": "allergicTo",
          "input": {
            "item": "strawberries",
            "score": 9
          },
          "expected": true
        }
      ]
    },
    {
      "description": "list when:",
      "comments": [
        "Given a number, list all things Tom is allergic to"
      ],
      "cases": [
        {
          "description": "no allergies",
          "property": "list",
          "input": {
            "score": 0
          },
          "expected": []
        },
        {
          "description": "just eggs",
          "property": "list",
          "input": {
            "score": 1
          },
          "expected": [
            "eggs"
          ]
        },
        {
          "description": "just peanuts",
          "property": "list",
          "input": {
            "score": 2
          },
          "expected": [
            "peanuts"
          ]
        },
        {
          "description": "just strawberries",
          "property": "list",
          "input": {
            "score": 8
          },
          "expected": [
            "strawberries"
          ]
        },
        {
          "description": "eggs and peanuts",
          "property": "list",
          "input": {
            "score": 3
          },
          "expected": [
            "eggs",
            "peanuts"
          ]
        },
        {
          "description": "more than eggs but not peanuts",
          "property": "list",
          "input": {
            "score": 5
          },
          "expected": [
            "eggs",
            "shellfish"
          ]
        },
        {
          "description": "lots of stuff",
          "property": "list",
          "input": {
            "score": 248
          },
          "expected": [
            "strawberries",
            "tomatoes",
            "chocolate",
            "pollen",
            "cats"
          ]
        },
        {
          "description": "everything",
          "property": "list",
          "input": {
            "score": 255
          },
          "expected": [
            "eggs",
            "peanuts",
            "shellfish",
            "strawberries",
            "tomatoes",
            "chocolate",
            "pollen",
            "cats"
          ]
        },
        {
          "description": "no allergen score parts",
          "property": "list",
          "input": {
            "score": 509
          },
          "expected": [
            "eggs",
            "shellfish",
            "strawberries",
            "tomatoes",
            "chocolate",
            "pollen",
            "cats"
          ]
        }
      ]
    }
  ]
}
