{
  "exercise": "nucleotide-count",
  "comments": [
    "Given a string of nucleotides, the count of each nucleotide is returned."
  ],
  "version": "1.1.0",
  "cases": [
    {
      "description": "counts all nucleotides in a provided strand.",
      "comments": [
        "nucleotideCounts counts all DNA-nucleotides in the input strand and returns an object with properties",
        "A, C, G and T holding their respective amounts."
      ],
      "cases": [
        {
          "description": "returns zeroes in case of an empty input strand.",
          "property": "nucleotideCounts",
          "strand": "",
          "expected": {
            "A": 0,
            "C": 0,
            "G": 0,
            "T": 0
          }
        },
        {
          "comments" : [
            "Should check for null-references and assume an empty input."
          ],
          "description": "returns zeroes for an undefined/null strand as argument.",
          "property": "nucleotideCounts",
          "strand": null,
          "expected": {
            "A": 0,
            "C": 0,
            "G": 0,
            "T": 0
          }
        },
        {
          "description": "returns the counts of nucleotides in a single-character input.",
          "property": "nucleotideCounts",
          "strand": "G",
          "expected": {
            "A": 0,
            "C": 0,
            "G": 1,
            "T": 0
          }
        },
        {
          "description": "returns the counts of nucleotides in a strand containing one repeated nucleotide.",
          "property": "nucleotideCounts",
          "strand": "GGGGGGG",
          "expected": {
            "A": 0,
            "C": 0,
            "G": 7,
            "T": 0
          }
        },
        {
          "description": "returns the count of nucleotides in a strand containing all nucleotides.",
          "property": "nucleotideCounts",
          "strand": "AGCTTTTCATTCTGACTGCAACGGGCAATATGTCTCTGTGTGGATTAAAAAAAGAGTGTCTGATAGCAGC",
          "expected": {
            "A": 20,
            "C": 12,
            "G": 17,
            "T": 21
          }
        },
        {
          "description": "returns the count of nucleotides in a strand containing mixed-case nucleotides.",
          "property": "nucleotideCounts",
          "strand": "aGcTtTtCaTtCtGaCtGcAaCgGgCaAtAtGtCtCtGtGtGgAtTaAaAaAaGaGtGtCtGaTaGcAgC",
          "expected": {
            "A": 20,
            "C": 12,
            "G": 17,
            "T": 21
          }
        },
        {
          "comments" : [
            "This should call the property/function at least two times and check if it returns the same",
            "result. This prevents errors where the call aggregates (sums up) the counts of each call."
          ],
          "description": "returns the same amounts for consecutive nucleotideCounts calls.",
          "property": "nucleotideCounts",
          "strand": "AGCTTTTCATTCTGACTGCAACGGGCAATATGTCTCTGTGTGGATTAAAAAAAGAGTGTCTGATAGCAGC",
          "expected" : true
        },
        {
          "description": "handles incorrect inputs.",
          "cases": [
            {
              "description": "throws error if DNA input does not include anything but ACGT-characters.",
              "property": "nucleotideCounts",
              "strand": "AGUUÃ„1+ :'A'}CT",
              "expected": {
                "error": "Invalid nucleotide in strand"
              }
            }
          ]
        }
      ]
    }
  ]
}
