{
  "exercise": "darts",
  "version": "2.1.0",
  "comments": [
    "Return the correct amount earned by a dart landing in a given point in the target."
  ],
  "cases": [
    {
      "property": "score",
      "description": "Missed target",
      "input": {
        "x": -9,
        "y": 9
      },
      "expected": 0
    },
    {
      "property": "score",
      "description": "On outer circle",
      "input": {
        "x": 0,
        "y": 10
      },
      "expected": 1
    },
    {
      "property": "score",
      "description": "On middle circle",
      "input": {
        "x": -5,
        "y": 0
      },
      "expected": 5
    },
    {
      "property": "score",
      "description": "On inner circle",
      "input": {
        "x": 0,
        "y": -1
      },
      "expected": 10
    },
    {
      "property": "score",
      "description": "Near centre",
      "input": {
        "x": -0.1,
        "y": -0.1
      },
      "expected": 10
    },
    {
      "property": "score",
      "description": "Just within inner circle",
      "input": {
        "x": 0.7,
        "y": 0.7
      },
      "expected": 10
    },
    {
      "property": "score",
      "description": "Just beyond inner circle",
      "input": {
        "x": 0.8,
        "y": -0.8
      },
      "expected": 5
    },
    {
      "property": "score",
      "description": "Just within middle circle",
      "input": {
        "x": -3.5,
        "y": 3.5
      },
      "expected": 5
    },   
    {
      "property": "score",
      "description": "Just beyond middle circle",
      "input": {
        "x": -3.6,
        "y": -3.6
      },
      "expected": 1
    },     
    {
      "property": "score",
      "description": "Just within outer circle",
      "input": {
        "x": -7.0,
        "y": 7.0
      },
      "expected": 1
    },     
    {
      "property": "score",
      "description": "Just beyond outer circle",
      "input": {
        "x": 7.1,
        "y": -7.1
      },
      "expected": 0
    },    
    {
      "property": "score",
      "description": "Asymmetric position between inner and middle circles",
      "input": {
        "x": 0.5,
        "y": -4
      },
      "expected": 5
    }
  ]
}
